<?xml version="1.0" encoding="UTF-8"?>
<!DOCTYPE validators SYSTEM "../dtd/validation.dtd">
<validators>

    <validator target="com.kjuns.controller.CommentController" method="queryComment">
	     <field name="id" dataType="String">
	 	    <rule validate="notEmpty" msg="动态ID不能为空"/>
	    </field>
	   	<field name="pageInvertedIndex" dataType="Integer">
	 		<rule validate="notEmpty" msg="反向结束索引不能为空"/>
	 		<rule validate="numeral" msg="反向结束索引应为数字"/>
	    </field>
	    <field name="pageSize" dataType="Integer">
	 		<rule validate="notEmpty" msg="显示条数不能为空"/>
	 		<rule validate="numeral" msg="显示条数应为数字"/>
	    </field>
    </validator>
    
    <validator target="com.kjuns.controller.CommentController" method="delComment">
	     <field name="id" dataType="String">
	 	    <rule validate="notEmpty" msg="评论ID不能为空"/>
	    </field>
	    <field name="contentId" dataType="String">
	 	    <rule validate="notEmpty" msg="内容ID不能为空"/>
	    </field>
	   	<field name="token" dataType="String">
	 	    <rule validate="notEmpty" msg="token不能为空"/>
	    </field>
	    <field name="signature" dataType="String">
			<rule validate="notEmpty" msg="signature不能为空" />
		</field>
    </validator>
    
    <validator target="com.kjuns.controller.CommentController" method="add">
	     <field name="id" dataType="String">
	 	    <rule validate="notEmpty" msg="内容ID不能为空"/>
	        <rule validate="numeral" msg="内容ID应为数字"/>
	    </field>
	    <field name="content" dataType="String">
	 	    <rule validate="notEmpty" msg="内容不能为空"/>
	    </field>
	    <field name="signature" dataType="String">
			<rule validate="notEmpty" msg="signature不能为空" />
		</field>
    </validator>

</validators>