<?xml version="1.0" encoding="UTF-8"?>
<!DOCTYPE validators SYSTEM "../dtd/validation.dtd">
<validators>

	<validator target="com.kjuns.controller.UserLoginController" method="login">
		<field name="signature" dataType="String">
			<rule validate="notEmpty" msg="signature不能为空" />
		</field>
	</validator>
	
	<validator target="com.kjuns.controller.UserLoginController" method="cellPhoneNumberIsExisting">
		<field name="cellPhoneNumber" dataType="String">
	 	    <rule validate="notEmpty" msg="手机号不能为空"/>
	    </field>
	</validator>

	<validator target="com.kjuns.controller.UserLoginController" method="loginOut">
		<field name="token" dataType="String">
			<rule validate="notEmpty" msg="token不能为空" />
		</field>
		<field name="signature" dataType="String">
			<rule validate="notEmpty" msg="signature不能为空" />
		</field>
	</validator>
	
	<validator target="com.kjuns.controller.UserLoginController" method="complete">
		<field name="idcard" dataType="String">
			<rule validate="notEmpty" msg="身份证不能为空" />
		</field>
		<field name="realName" dataType="String">
			<rule validate="notEmpty" msg="真名不能为空" />
		</field>
		<field name="nickName" dataType="String">
			<rule validate="notEmpty" msg="昵称不能为空" />
		</field>
		<field name="id" dataType="String">
			<rule validate="notEmpty" msg="id不能为空" />
		</field>
		<field name="signature" dataType="String">
			<rule validate="notEmpty" msg="signature不能为空" />
		</field>
	</validator>

</validators>