<?xml version="1.0" encoding="UTF-8"?>
<!DOCTYPE validators SYSTEM "../dtd/validation.dtd">
<validators>

	<validator target="com.kjuns.controller.UserInfoController" method="getUserInfo">
		<field name="token" dataType="String">
			<rule validate="notEmpty" msg="token不能为空" />
		</field>
	</validator>

	<validator target="com.kjuns.controller.UserInfoController" method="getOtherUserInfo">
		<field name="userId" dataType="String">
			<rule validate="notEmpty" msg="用户ID不能为空" />
		</field>
	</validator>
	
<!-- 	<validator target="com.kjuns.controller.UserInfoController" method="completeUserInfo">
		<field name="faceSrc" dataType="String">
			<rule validate="notEmpty" msg="头像不能为空" />
		</field>
		<field name="sex" dataType="String">
			<rule validate="notEmpty" msg="性别不能为空" />
		</field>
		<field name="nickName" dataType="String">
			<rule validate="notEmpty" msg="昵称不能为空" />
		</field>
		<field name="token" dataType="String">
			<rule validate="notEmpty" msg="token不能为空" />
		</field>
		<field name="signature" dataType="String">
			<rule validate="notEmpty" msg="signature不能为空" />
		</field>
	</validator> -->
	
	<validator target="com.kjuns.controller.UserInfoController" method="nickNameIsExisting">
		<field name="nickName" dataType="String">
			<rule validate="notEmpty" msg="昵称不能为空" />
		</field>
		<field name="signature" dataType="String">
			<rule validate="notEmpty" msg="signature不能为空" />
		</field>
	</validator>
	
	<validator target="com.kjuns.controller.UserInfoController" method="changeUserInfo">
		<field name="token" dataType="String">
			<rule validate="notEmpty" msg="token不能为空" />
		</field>
		<field name="signature" dataType="String">
			<rule validate="notEmpty" msg="signature不能为空" />
		</field>
	</validator>

   
 
    
</validators>