<?xml version="1.0" encoding="UTF-8"?>
<!DOCTYPE validators SYSTEM "../dtd/validation.dtd">
<validators>

    <validator target="com.kjuns.controller.ContentController" method="list">
	     <field name="typeId" dataType="String">
	 	    <rule validate="notEmpty" msg="类别ID不能为空"/>
	    </field>
	   	<field name="pageInvertedIndex" dataType="Integer">
	 		<rule validate="notEmpty" msg="反向结束索引不能为空"/>
	 		<rule validate="numeral" msg="反向结束索引应为数字"/>
	    </field>
	    <field name="pageSize" dataType="Integer">
	 		<rule validate="notEmpty" msg="显示条数不能为空"/>
	 		<rule validate="numeral" msg="显示条数应为数字"/>
	    </field>
    </validator>
    
    <validator target="com.kjuns.controller.ContentController" method="detail">
	     <field name="id" dataType="String">
	 	    <rule validate="notEmpty" msg="评论ID不能为空"/>
	    </field>
    </validator>
    
    <validator target="com.kjuns.controller.ContentController" method="del">
	     <field name="id" dataType="String">
	 	    <rule validate="notEmpty" msg="评论ID不能为空"/>
	    </field>
	   	<field name="token" dataType="String">
	 	    <rule validate="notEmpty" msg="token不能为空"/>
	    </field>
	    <field name="signature" dataType="String">
			<rule validate="notEmpty" msg="signature不能为空" />
		</field>
    </validator>
    
    <validator target="com.kjuns.controller.ContentController" method="add">
	     <field name="sectionId" dataType="String">
	 	    <rule validate="notEmpty" msg="栏目ID不能为空"/>
	    </field>
	     <field name="title" dataType="String">
	 	    <rule validate="notEmpty" msg="标题不能为空"/>
	    </field>
	    <field name="content" dataType="String">
	 	    <rule validate="notEmpty" msg="内容不能为空"/>
	    </field>
	    <field name="token" dataType="String">
	 	    <rule validate="notEmpty" msg="token不能为空"/>
	    </field>
	    <field name="signature" dataType="String">
			<rule validate="notEmpty" msg="signature不能为空" />
		</field>
    </validator>
    
    <validator target="com.kjuns.controller.ContentController" method="like">
	     <field name="id" dataType="String">
	 	    <rule validate="notEmpty" msg="内容ID不能为空"/>
	    </field>
	   	<field name="token" dataType="String">
	 	    <rule validate="notEmpty" msg="token不能为空"/>
	    </field>
	    <field name="signature" dataType="String">
			<rule validate="notEmpty" msg="signature不能为空" />
		</field>
    </validator>
  
    <validator target="com.kjuns.controller.ContentController" method="share">
	     <field name="id" dataType="String">
	 	    <rule validate="notEmpty" msg="内容ID不能为空"/>
	    </field>
	   	<field name="token" dataType="String">
	 	    <rule validate="notEmpty" msg="token不能为空"/>
	    </field>
	    <field name="signature" dataType="String">
			<rule validate="notEmpty" msg="signature不能为空" />
		</field>
    </validator>

</validators>